title;brand;model
Микрофон конденсаторный JTS GML-5212;
Микрофон конденсаторный JTS GML-5218;
Микрофон конденсаторный JTS NX-8.8;
Микрофон конденсаторный JTS NX-9;
Микрофон конденсаторный JTS TX-9;
Микрофон наголовный Audio-Technica ATM73ac;
Микрофон наголовный Audio-Technica BP892cW-TH;
Микрофон наголовный Audio-Technica BP893cW;
Микрофон наголовный Audio-Technica PRO9CW;
Микрофон наголовный JTS CM-214F;
Микрофон наголовный JTS CM-214ULF;
Микрофон наголовный JTS CM-225;
Микрофон наголовный JTS CX-504;
Микрофон петличный Audio-Technica AT829cW;
Микрофон петличный Audio-Technica AT831aW;
Микрофон петличный Audio-Technica AT831b;
Микрофон петличный Audio-Technica AT831cW;
Микрофон петличный Audio-Technica AT831R;
Микрофон петличный Audio-Technica AT899;
Микрофон петличный Audio-Technica AT899cW;
Микрофон петличный Audio-Technica AT899cW-TH;
Микрофон петличный Audio-Technica ATR3350;
Микрофон петличный Audio-Technica ATR3350IS;
Микрофон петличный Audio-Technica ATR35cW;
Микрофон петличный JTS CM-125F-;
Микрофон петличный JTS CM-201;
Микрофон петличный JTS CM-201F;
Микрофон петличный JTS CM-501;
Микрофон подвесной JTS CM-502;
Микрофон подвесной JTS CM-502WT;
Микрофон студийный Audio-Technica AT2010;
Микрофон студийный Audio-Technica AT2020;
Микрофон студийный Audio-Technica AT2020USB+;
Микрофон студийный Audio-Technica AT2020USBi;
Микрофон студийный Audio-Technica AT2031;
Микрофон студийный Audio-Technica AT2035;
Микрофон студийный Audio-Technica AT2050;
Микрофон студийный Audio-Technica AT4033aSM;
Микрофон студийный Audio-Technica AT4050;
Микрофон студийный Audio-Technica AT4050URUSHI;
Микрофон студийный CANTO STUDIO 101USB BK M/O;
Микрофон студийный CANTO STUDIO 202 USB M/O;
Микрофон студийный Groove Tubes GT30;
Микрофон студийный Groove Tubes GT40;
Микрофон студийный JTS JS-1E;
Микрофон студийный JTS JS-1T;
Микрофон студийный JTS JS-22;
Микрофон студийный SENNHEISER MK 4;
Микрофон универсальный Groove Tubes L.L.C. GT Convertible;
Микрофонная консоль JDM RA-1051A;
Микрофонный кабель KLOTZ AU-MF0150;
Микрофонный кабель KLOTZ AU-MF0300;
Микрофонный кабель KLOTZ GRG1FM03.0;
Микрофонный кабель KLOTZ GRG1FM05.0;
Микрофонный кабель KLOTZ GRG1FM10.0;
Микрофонный кабель KLOTZ GRG1MP01.5;
Микрофонный кабель KLOTZ GRG1MP03.0;
Микрофонный комплект On-Stage Stands MS7510;
Микрофонный комплект On-Stage Stands MS7515;
Микшерный пульт American Audio Q-FX PRO;
Микшерный пульт YAMAHA 01V96i;
Микшерный пульт YAMAHA AG03;
Микшерный пульт YAMAHA AG06;
Микшерный пульт YAMAHA CL5;
Микшерный пульт YAMAHA MG06;
Микшерный пульт YAMAHA MG06X;
Микшерный пульт YAMAHA MG10;
Микшерный пульт YAMAHA MG10XU;
Микшерный пульт YAMAHA MG12;
Микшерный пульт YAMAHA MG12XU;
Микшерный пульт YAMAHA MG16;
Микшерный пульт YAMAHA MG16XU;
Микшерный пульт YAMAHA MG20XU;
Микшерный пульт YAMAHA MGP12X;
Микшерный пульт YAMAHA MGP16X;
Микшерный пульт YAMAHA MGP24X;
Микшерный пульт YAMAHA QL5;
Микшерный пульт с медиа рекордером American Audio Q-SD;
Микшер-предусилитель JDM MA-1410;
Микширующий усилитель JDM FX-2425;
Микширующий усилитель JDM ZA-6480;
Мікрофон AKG P-120;
Мікрофон вокальний AKG D5 S;
Мобильное рабочее место American Audio DJ-6T;
Мобильное рабочее место American Audio DJ-MTS6;
Мониторные наушники SHURE SRH 840;
Мониторные наушники SHURE SRH 940-E;
Монтажный кронштейн On-Stage Stands SS7322B;
Мультикабель KLOTZ PW12-X;
Мультикабель KLOTZ PW24-X;
Мультикор American Audio AC-SN8-JS/5;
Мультикор Hotwires SNK164100;
Мультикор Hotwires SNK16450;
Мультикор Hotwires SNK24450;
Мультикор KLOTZ C16/4M30;
Мультикор KLOTZ SL16/4EC30-;
Мундштук YAMAHA AS4C;
Мундштук YAMAHA AS5C;
Мундштук YAMAHA AS5CM;
Мундштук YAMAHA AS6CM;
Мундштук YAMAHA AS7C;
Мундштук YAMAHA BB67;
Мундштук YAMAHA BL59GP;
Мундштук YAMAHA CL3C;
Мундштук YAMAHA CL4C;
Мундштук YAMAHA CL5C;
Мундштук YAMAHA HR31BII-;
Мундштук YAMAHA HR32D4;
Мундштук YAMAHA MP32C;
Мундштук YAMAHA TR11A4;
Мундштук YAMAHA TR11B4;
Мундштук YAMAHA TR11C4;
Мундштук YAMAHA TR14A4A;
Мундштук YAMAHA TR14C4;
Мундштук YAMAHA TR18C4;
Мундштук YAMAHA TR7A4;
Мундштук YAMAHA TR7B4;
Мундштук YAMAHA TR8C4;
Мягкий футляр для альт-саксофона Stagg SC-AS;
Мягкий футляр для тенор-саксофона Stagg HBB TS;
Мягкий футляр для тромбона Stagg HBB TB;
Мягкий футляр для трубы Stagg SC-TP;
Мягкий футляр для флейты Stagg SC-FL;
Набор ветрозащит для микрофона Stagg WS-S35/C6;
Набор винтов Ernie Ball P04242;
Набор губных гармошек Stagg BJH-B20 SET1;
Набор для управления студийными мониторам Genelec 8300-601-PACK;
Набор медиаторов Stagg FPS-M;
Набор осветителей Mighty Bright Roadie Light Silver;
Набор перкуссии Stagg CPK-01;
Набор перкуссии Stagg CPK-02;
Набор перкуссии Stagg CPK-04;
Набор пэдов YAMAHA DTP4K2SP;
Набор тарелок Istanbul Mehmet FR-SET-1;
Набор тарелок Stagg AXK SET;
Набор тарелок Stagg CXG SET;
Набор тарелок Stagg DXK SET;
Набор тарелок Stagg SH-SET;
Набор тренировочных пэдов Stagg DF1222 SET;
Набор Укулеле MAHALO MJ1tbrk;
Набор Укулеле MAHALO MK1TBRK;
Набор Укулеле MAHALO MR1BKK;
Набор Укулеле MAHALO MR1BUK;
Набор Укулеле MAHALO MR1TBR-PK;
Набор чехлов для барабанов Stagg PBS-1 ECO/5;
Набор чехлов для барабанов Stagg PBS-2 ECO/5;
Набор чехлов для барабанов Stagg PBS-3 ECO/5;
Набор чехлов для барабанов Stagg SPBS-3 PACK/5;
Накидка Mendelssohn Cover B Black;
Накидка Mendelssohn Cover C Black;
Накидка для синтезатора On-Stage Gear KDA7061B;
Накидка для синтезатора On-Stage Gear KDA7061G;
Накидка для синтезатора On-Stage Gear KDA7088B;
Накидка для синтезатора On-Stage Gear KDA7088G;
Направляющая YAMAHA A0141090;
Настольный микрофон JTS TT-50;
Наушники AKG K-182;
Наушники AKG K271 MK II;
Наушники AKG K-52;
Наушники AKG K-701;
Наушники AKG K-702;
Наушники AKG K-72;
Наушники AKG K-92;
Наушники AKG P-420;
Наушники American Audio HP200;
Наушники Audio-Technica ATH-330COM;
Наушники Audio-Technica ATH-750COM;
Наушники Audio-Technica ATH910PRO;
Наушники Audio-Technica ATH-AVC200;
Наушники Audio-Technica ATH-E40;
Наушники Audio-Technica ATH-E50;
Наушники Audio-Technica ATH-E70;
Наушники Audio-Technica ATH-M20X;
Наушники Audio-Technica ATH-M30X;
Наушники Audio-Technica ATH-M40fs;
Наушники Audio-Technica ATH-M40X;
Наушники Audio-Technica ATH-M50X;
Наушники Audio-Technica ATH-M50X MG;
Наушники Audio-Technica ATH-M50X WH;
Наушники Audio-Technica ATH-M60X;
Наушники Audio-Technica ATH-M70X;
Наушники Audio-Technica ATH-PRO500 SV;
Наушники Audio-Technica ATH-PRO500MK2 RD;
Наушники Audio-Technica ATH-PRO500MK2BK;
Наушники Audio-Technica ATH-PRO5MK2 CM;
Наушники Audio-Technica ATH-PRO5MK2 SV;
Наушники Audio-Technica ATH-PRO5XBK;
Наушники Audio-Technica ATH-PRO700MK2;
Наушники Audio-Technica ATH-PRO7X;
Наушники Audio-Technica ATH-R70X;
Наушники Audio-Technica ATH-T200;
Наушники Audio-Technica ATH-T300;
Наушники Audio-Technica ATH-TAD300;
Наушники Audio-Technica ATH-TAD400;
Наушники Audio-Technica ATUC-HP2;
Наушники JBL E65BTNCBLU;
Наушники JBL JR300BLU;
Наушники JBL JR300BTPIK;
Наушники JBL JR300BTTEL;
Наушники JBL JR300RED;
Наушники JBL REFMINIBLU2;
Наушники JBL T110BLK;
Наушники JBL T110BTBLK;
Наушники JBL T205BLK;
Наушники JBL T460BTBLK;
Наушники JBL T500BLK;
Наушники JBL T500BTBLK;
Наушники JBL T500BTBLU;
Наушники JBL T500BTWHT;
Наушники JBL T500WHT;
Наушники JTS HP-535;
Наушники JTS HP-565;
Наушники JTS HPM-12;
Наушники JTS HPM-535;
Наушники JTS IE-1;
Наушники SENNHEISER HD 25;
Наушники SENNHEISER HD 280 PRO;
Наушники SENNHEISER HD 300 PRO;
Наушники SENNHEISER RS 120-8;
Наушники SENNHEISER RS 160 ASIA;
Наушники Stagg SHP-1200H;
Наушники YAMAHA HPH-MT5;
Наушники YAMAHA HPH-MT5W;
Наушники YAMAHA HPH-MT7;
Наушники YAMAHA HPH-MT7W;
Наушники YAMAHA RH-5MA;
Ножная педаль YAMAHA FP7210A;
Ножная педаль YAMAHA FP9500C;
Обруч для барабана YAMAHA U0066030;
Обруч для барабана YAMAHA U0069530;
Обруч для барабана YAMAHA U0069550;
Обруч для барабана YAMAHA U0069560;
Обруч для барабана YAMAHA U0069570;
Обруч для барабана YAMAHA U0069590;
Осветитель Mighty Bright Duet;
Осветитель Mighty Bright Triple LED Silver;
Осветитель On-Stage Gear LED102;
Осветитель On-Stage Gear LED202;
Осветитель On-Stage Gear LED204;
Очиститель мундштука YAMAHA MOUTHPIECE SWAB L;
Очиститель мундштука YAMAHA MOUTHPIECE SWAB M;
Очиститель мундштука YAMAHA MOUTHPIECE SWAB S;
Очиститель тоновых отверстий YAMAHA TONE HOLE CLEANER;
Палочки (маллеты) для вибрафона Stagg SMV-RH;
Палочки (маллеты) для перкуссии Stagg SMB-WB;
Палочки (маллеты) для перкуссии Stagg SMM-WS;
Палочки (маллеты) для перкуссии Stagg SMV-RS;
Палочки (руты) для ударных Kuppmen CFDR2B;
Палочки (руты) для ударных Kuppmen CFDR5A;
Палочки (руты) для ударных Kuppmen CFDR5B;
Палочки (руты) для ударных Kuppmen CFDR7A;
Палочки YAMAHA MR2000;
Палочки YAMAHA MV4020;
Палочки для перкуссии Stagg SMD-F1;
Палочки для перкуссии Stagg SMD-F2;
Палочки для перкуссии Stagg SMD-F3;
Палочки для перкуссии Stagg SMV-RM;
Педаль (футсвитч) KUSTOM KAC FS100;
Педаль (футсвитч) KUSTOM KAC FS101M;
Педаль (футсвитч) KUSTOM KAC FS301;
Педаль Bass Limiter BETA AIVIN BLM1;
Педаль BBE Ben WAH;
Педаль BBE CRUSHER;
Педаль BBE ORANGESQUASH;
Педаль BETA AIVIN FL100;
Педаль Chorus Ensemble BETA AIVIN CE100;
Педаль Equaliser BETA AIVIN EQ100;
Педаль MarkBass DV EVO 1 CONTROLLER;
Педаль MarkBass MULTIAMP MIDI PEDALBOARD;
Педаль YAMAHA FC 5;
Педаль вибрато/хорус BBE MINDBENDER;
Педаль гитарных еффектов BETA AIVIN HM100;
Педаль гитарных эффектов ARION MEQ-1;
Педаль гитарных эффектов NUX AB-3;
Педаль гитарных эффектов NUX METAL CORE;
Педаль гитарных эффектов NUX PT-5;
Педаль гитарных эффектов VISUAL SOUND TREMOLO;
Педаль делэй двойной аналоговый BBE TWO TIMER TT2;
Педаль для бас-барабана Stagg PP-50;
Педаль симулятор vibe/rotary speaker BBE SOULVIBE;
Педаль сустейна Stagg SUSPED 10;
Педаль сустейна Stagg SUSPED 5;
Педаль сустейна YAMAHA FC 4A;
Педаль сустейна YAMAHA FC3A;
Педаль тремоло BBE Tremor TR-63B;
Педаль экспрессии M-AUDIO EX-P;
Педаль экспрессии YAMAHA FC 7;
Педаль эффектов Chorus DAPHON E20CH;
Педаль эффектов DAPHON E20CM;
Педаль эффектов DV Mark DV MINI DIST;
Педаль эффектов DV Mark GUITAR TUBE MARKER-;
Педаль эффектов DV Mark OVER MARKER-;
Педаль эффектов Markbass BASS TUBE MARKER-;
Педаль эффектов MarkBass COMPRESSORE;
Педаль эффектов Markbass DV FUZZER-;
Педаль эффектов Markbass DV MINI BOOST-;
Педаль эффектов Markbass DV7 BOOSTER-;
Педаль эффектов Markbass DV7 DISTORSORE-;
Педаль эффектов Markbass DVM COMPRESSORE-;
Педаль эффектов Markbass MB MINI BOOST-;
Педаль эффектов Markbass MB OCTAVER-;
Педаль эффектов Markbass MB7 BOOSTER-;
Педаль эффектов Markbass MB7 DISTORSORE-;
Педаль эффектов MarkBass SUPER SYNTH;
Педаль эффектов Over Drive DAPHON E20OD;
Педаль эффектов Stagg BX-CHORUS;
Педаль эффектов Stagg BX-DELAY;
Педаль эффектов Stagg BX-DIST A;
Педаль эффектов Stagg BX-DIST B;
Педаль эффектов Stagg BX-DRIVE A;
Педаль эффектов Stagg BX-DRIVE B;
Педаль эффектов Stagg BX-LOOP;
Педаль эффектов Stagg BX-PHASER;
Пенал Stagg DSH;
Передатчик Audio-Technica AEW-T1000a;
Передатчик Audio-Technica ATW-T1007;
Передатчик Audio-Technica ATW-T1F;
Передатчик JTS SIEM-111T;
Переходная гайка American Audio RT1;
Пианика Stagg MELOSTA32 BK;
Пианика Stagg MELOSTA32 BL;
Пианика Stagg MELOSTA32 PK;
Пианика Stagg MELOSTA32 RD;
Пианика Stagg MELOSTA37 BK;
Пианика Stagg MELOSTA37 BL;
Пианика Stagg MELOSTA37 RD;
Пианика YAMAHA P-32D;
Пианика YAMAHA P-37D;
Пианино Mendelssohn JP-13F3-123-K;
Пианино Mendelssohn JP-55A3-118-K;
Пианино Mendelssohn SP-21E3-125-K;
Пианино Petrof P118M1-0001;
Пианино Petrof P118M1-0801;
Пианино YAMAHA JU109 PE;
Пианино YAMAHA JU109 PW;
Пианино YAMAHA JU109 PWH;
Пианино YAMAHA JX113CP PM;
Пианино YAMAHA JX113T PE;
Пианино YAMAHA M2 SM;
Планка для рэка Stagg P19-3U;
Планка для рэка Stagg P19U-3U;
Планка для рэка Stagg P19U-4U;
Планка под гнезда XLR Stagg DP12X0H;
Плата для микшерного пульта YAMAHA MY16-AE;
Плата для микшерного пульта YAMAHA MY16-ES64;
Плата для микшерного пульта YAMAHA MY16-EX;
Плата для микшерного пульта YAMAHA MY16-MD64;
Плата для микшерного пульта YAMAHA MY8-ADDA96;
Плата для микшерного пульта YAMAHA MY8-DA96;
Плата для микшерного пульта YAMAHA MY8-TD-;
Плата для микшерного пульта YAMAHA NY64-D;
Плата расширения YAMAHA AD-8HR;
Подбородник для скрипки Maxtone VN CR1/2;
Подвес On-Stage Stands MY410;
Подвес On-Stage Stands MY410CG;
Подставка JTS ST-5030;
Подставка JTS ST-5030i;
Подставка JTS ST-5070;
Подставка JTS ST-5071;
Подставка YAMAHA CHH 920;
Подставка YAMAHA CS655A;
Подставка YAMAHA CS755;
Подставка YAMAHA CSAT932;
Подставка YAMAHA L-7S;
Подставка для 2-х гитар Stagg SG-A200 HBK;
Подставка для 2-х саксофонов Stagg WIS-A33;
Подставка для 3-х гитар Stagg SG-A300 CR;
Подставка для 5-и гитар Stagg SG-A010/5 BK;
Подставка для 5-ти гитар унив. On-Stage Stands GS7561;
Подставка для ак. системы On-Stage Stands SS7766B;
Подставка для ак.системы On-Stage Stands SS7761B;
Подставка для акустической гитары Stagg SG-A107BK;
Подставка для акустической гитары Stagg SG-AW50 RW;
Подставка для акустической системы (тренога) Stagg SPS-2020 AL;
Подставка для акустической системы (тренога) Stagg SPS-2020 ALB;
Подставка для акустической системы (тренога) Stagg SPS-2020 BK;
Подставка для акустической системы (тренога) Stagg SPS-A0020 AB;
Подставка для акустической системы (тренога) Stagg SPS-A1020 AL;
Подставка для акустической системы On-Stage Stands SMS6000-P;
Подставка для акустической системы On-Stage Stands SS7725;
Подставка для акустической системы On-Stage Stands SS7730B;
Подставка для акустической системы On-Stage Stands SS7762B;
Подставка для акустической системы On-Stage Stands SS8800B+;
Подставка для аппаратуры Stagg MRS-A13/7U;
Подставка для виолончели Stagg SV-CE;
Подставка для гитары Stagg SG-A600 BK;
Подставка для гитары универсальная On-Stage Stands GS7362B;
Подставка для гитары универсальная On-Stage Stands GS7462B;
Подставка для гитары универсальная Stagg SG-A108BK;
Подставка для комбика/монит. On-Stage Stands RS9050;
Подставка для комбика/монитора On-Stage Stands RS7705;
Подставка для комбика/монитора Stagg GAS-4.2;
Подставка для конго Stagg C1AS-10;
Подставка для конго Stagg C1AS-11;
Подставка для конго Stagg CDAS;
Подставка для микрофона JTS ST-5050i;
Подставка для микшерного пульта On-Stage Stands MIX400;
Подставка для микшерного пульта Stagg MXS-2H;
Подставка для ноги гитариста Stagg FOS-A1 BK;
Подставка для ноги гитариста Stagg FOS-A1 WD;
Подставка для ноги гитариста Stagg FOS-B1 BK;
Подставка для ноутбука On-Stage Stands LPT6000;
Подставка для саксофона Stagg WIS-A30;
Подставка для саксофона Stagg WIS-A34;
Подставка для света Stagg LIS-A2022 BK;
Подставка для светоприборов On-Stage Stands LS7730;
Подставка для светоприборов On-Stage Stands LS7805B;
Подставка для светоприборов On-Stage Stands LS9790;
Подставка для синтезатора On-Stage Stands KS7100;
Подставка для синтезатора On-Stage Stands KS7150;
Подставка для синтезатора On-Stage Stands KS7171;
Подставка для синтезатора On-Stage Stands KS7190;
Подставка для синтезатора On-Stage Stands KS7191;
Подставка для синтезатора On-Stage Stands KS7290;
Подставка для синтезатора On-Stage Stands KS7291;
Подставка для синтезатора On-Stage Stands KS7350;
Подставка для синтезатора On-Stage Stands KS7365EJ;
Подставка для синтезатора On-Stage Stands KS7390;
Подставка для синтезатора On-Stage Stands KS7491;
Подставка для синтезатора On-Stage Stands KS7590;
Подставка для синтезатора On-Stage Stands KS7590BB;
Подставка для синтезатора On-Stage Stands KS7591;
Подставка для синтезатора On-Stage Stands KS7591BB;
Подставка для синтезатора On-Stage Stands KS7902;
Подставка для синтезатора On-Stage Stands KS7903;
Подставка для синтезатора On-Stage Stands KS8190X;
Подставка для синтезатора On-Stage Stands KS8191XX;
Подставка для синтезатора On-Stage Stands KS8290X;
Подставка для синтезатора On-Stage Stands KS8291XX;
Подставка для синтезатора On-Stage Stands KS8390X;
Подставка для синтезатора On-Stage Stands KS8391XX;
Подставка для синтезатора On-Stage Stands KSA7500;
Подставка для синтезатора On-Stage Stands KSA7550;
Подставка для синтезатора On-Stage Stands KSA8000;
Подставка для синтезатора Stagg KXS-A4;
Подставка для синтезатора Stagg KXS-A6;
Подставка для синтезатора Stagg KXS-A7;
Подставка для синтезатора Stagg KXS-C34BKH;
Подставка для тренировочного пэда Stagg LPPS-25/R;
Подставка для трубы Stagg WIS-A10 BK;
Подставка для трубы Stagg WIS-A15 BK;
Подставка для трубы Stagg WIS-A20 BK;
Подставка для флейты / кларнета Stagg WIS-A40;
Подставка для электро- и бас-гитары Stagg SG-A109BK;
Подставка малого барабана Stagg LSD-25.2;
Подставка малого барабана Stagg LSD-50;
Подставка тарелки Stagg LYD-50;
Подставка хай-хета Stagg LHD-25.2;
Подставка хай-хета Stagg LHD-50;
Подставка хай-хета Stagg LHD-52;
Подструнник для малого барабана YAMAHA SNRS;
Подструнник для малого барабана YAMAHA SNRSW;
Полировочная ткань YAMAHA POLISHING CLOTH DX L;
Полировочная ткань YAMAHA POLISHING CLOTH DX M;
Полировочная ткань YAMAHA POLISHING CLOTH L;
Полировочная ткань YAMAHA POLISHING CLOTH S;
Полироль YAMAHA LACQUER POLISH;
Полироль YAMAHA LACQUER POLISH 110CC;
Полироль YAMAHA METAL POLISH;
Полироль YAMAHA SILVER POLISH;
Полироль YAMAHA SILVER POLISH 110CC;
Поп-фильтр для микрофона On-Stage Stands ASVS6B;
Поп-фильтр для микрофона On-Stage Stands ASVS6GB;
Портативная активная акустическая система Maximum Acoustics ACTIVE.15;
Портативная активная акустическая система Maximum Acoustics ACTIVE.15MH;
Портативная активная акустическая система Maximum Acoustics Mobi.10;
Портативная активная акустическая система Maximum Acoustics Mobi.12;
Портативная активная акустическая система Maximum Acoustics Mobi.120;
Портативная активная акустическая система Maximum Acoustics Mobi.15;
Портативная активная акустическая система Maximum Acoustics Mobi.150;
Портативное устройство звукозаписи YAMAHA Pocketrak2G;
Портативный микшер YAMAHA SC-01;
Портативный микшер YAMAHA SC-02;
Поясной передатчик Audio-Technica ATW-T1001;
Поясок-крепление для передатчика JTS Aerobic belt bag;
Приемник Audio-Technica AEW-R4100CEU;
Приемник Audio-Technica AEW-R5200;
Программно-аппаратный комплекс Steinberg Cubase Artist Plus Pack-;
Программное обеспечение M-Audio Producer Fact Pro Bundle-;
Программное обеспечение M-Audio Session-;
Программное обеспечение Spectrasonics Keyscape;
Программное обеспечение Steinberg Absolute VSTi Col. EE-;
Программное обеспечение Steinberg Absolute VSTi Col. Retail;
Программное обеспечение Steinberg Classroom Ressource Pack-;
