title;brand;model
"""Тихая"" гитара YAMAHA SLG200N NATURAL";
"""Тихая"" гитара YAMAHA SLG200N TOBACCO BROWN SUNBURST";
"""Тихая"" гитара YAMAHA SLG200S NATURAL";
"""Тихая"" гитара YAMAHA SLG200S TOBACCO BROWN SUNBURST";
DMX Диммер American Audio RMD 1210;
HDMI кабель KLOTZ HA-HA-H05;
HDMI кабель KLOTZ HA-HA-HE02;
HDMI кабель KLOTZ HDMI-HI010;
HDMI кабель KLOTZ HDMI-HI020;
HDMI кабель KLOTZ HDMI-HI030;
HDMI кабель KLOTZ HDMI-HI050;
KLOTZ MY204SW;
MIDI интерфейс YAMAHA UX-16;
MIDI кабель Stagg SMD1;
MIDI кабель Stagg SMD2;
MIDI кабель Stagg SMD3;
MIDI кабель Stagg SMD6;
MIDI клавиатура ALESIS Q25;
MIDI клавиатура ALESIS Q49;
MIDI клавиатура ALESIS V61;
MIDI-клавиатура M-Audio Axiom 25 MKII;
MIDI-клавиатура M-Audio Axiom 49 MKII;
MIDI-клавиатура M-Audio Axiom 61 MKII;
MIDI-клавиатура M-Audio AXIOM AIR 25;
MIDI-клавиатура M-Audio AXIOM AIR 49;
MIDI-клавиатура M-Audio AXIOM AIR 61;
MIDI-клавиатура M-Audio Oxygen 88;
Sustain педаль On-Stage Gear KSP100;
Sustain педаль On-Stage Gear KSP20;
USB кабель SoundKing SKBS015 - USB 2.0 Cable;
USB ключ Steinberg USB eLicenser;
XLRF / 2 RCA;
Абразивная бумага YAMAHA POWDER PAPER;
Автоматический микшер Audio-Technica AT-MX341b;
Агого Stagg AGGM-2;
Агого Stagg AGGM-3;
Адаптер Jack/mini Jack Stagg AC-PFJMH;
Адаптер JTS MA-500;
Адаптер JTS MA-500E;
Адаптер JTS MA-63;
Адаптер Mighty Bright LED A/C Adapter;
Адаптер для рэка Stagg RC19-1U;
Адаптер лля микрофонов Audio-Technica AT8444;
Аккумулятор Audio-Technica LI-240;
Аккустическая система активная JBL 305PMKII-UK;
Аккустическая система активная JBL 305PMKII-WH-EU;
Аккустическая система активная JBL 306PMKII-EU;
Аккустическая система активная JBL 308PMKII-EU;
Активная акустическая система HH TRE-110A;
Активная акустическая система Park Audio T141-P;
Активный вертикальный линейный массив Park Audio 4815,05;
Активный вертикальный линейный массив Park Audio SPIKE3610.05;
Активный вертикальный линейный массив Park Audio SPIKE3812.05;
Активный вертикальный линейный массив PARK AUDIO SPIKE4818.05 Duo;
Активный звукоусилительный комплекс Park Audio DUPLEX SET;
Активный звукоусилительный комплект Park Audio CLASSIC SET 2100.01;
Активный звукоусилительный комплект Park Audio L-set 101;
Активный монитор PARK AUDIO DELTA 5212-P;
Акустическая гитара CANTO C100 TRD;
Акустическая гитара CANTO C200 CS;
Акустическая гитара FLYCAT C100 BK;
Акустическая гитара FLYCAT C100 NT;
Акустическая гитара FLYCAT C100 TSB;
Акустическая гитара IBANEZ AW30 Natural;
Акустическая гитара Stagg NA30;
Акустическая гитара Stagg NA30F;
Акустическая гитара Stagg SA20D BLK;
Акустическая гитара Stagg SA20D BLUE;
Акустическая гитара Stagg SA20D NAT;
Акустическая гитара Stagg SA20D RED;
Акустическая гитара Stagg SA20D SNB;
Акустическая гитара Stagg SW201 3/4 N;
Акустическая гитара Stagg SW201 BK;
Акустическая гитара Stagg SW201 BKS;
Акустическая гитара Stagg SW201 CS;
Акустическая гитара Stagg SW201 N;
Акустическая гитара Stagg SW201 RDS;
Акустическая гитара Stagg SW201 SB;
Акустическая гитара Stagg SW203 N;
Акустическая гитара Stagg SW205 N;
Акустическая гитара Tanglewood TW133 ASM PARLOR;
Акустическая гитара Tanglewood TW28PW;
Акустическая гитара Tanglewood TW40D-ANE;
Акустическая гитара Tanglewood TW6;
Акустическая гитара Tanglewood TWCR-O;
Акустическая гитара Tanglewood TWCR-T;
Акустическая гитара Tanglewood TWJDS;
Акустическая гитара Tanglewood TWJ-J1;
Акустическая гитара YAMAHA C-80;
Акустическая гитара YAMAHA CGS102A;
Акустическая гитара YAMAHA CGS103A;
Акустическая гитара YAMAHA F 310;
Акустическая гитара YAMAHA F310 CS;
Акустическая гитара YAMAHA F310 TBS;
Акустическая гитара YAMAHA F370;
Акустическая гитара YAMAHA F370 DW;
Акустическая гитара YAMAHA F370 TBS;
Акустическая гитара YAMAHA FG700S;
Акустическая гитара YAMAHA FG720S;
Акустическая гитара YAMAHA FG720S BL;
Акустическая гитара YAMAHA FG720S-12;
Акустическая гитара YAMAHA FG800 BLACK;
Акустическая гитара YAMAHA FG800 BROWN SUNBURST;
Акустическая гитара YAMAHA FG800 NATURAL;
Акустическая гитара YAMAHA FG800 SAND BURST;
Акустическая гитара YAMAHA FG820 AUTUMN BURST;
Акустическая гитара YAMAHA FG820 BLACK;
Акустическая гитара YAMAHA FG820 BROWN SUNBURST;
Акустическая гитара YAMAHA FG820 NATURAL;
Акустическая гитара YAMAHA FG820 SUNSET BLUE;
Акустическая гитара YAMAHA FG820-12 NATURAL;
Акустическая гитара YAMAHA FG830 AUTUMN BURST;
Акустическая гитара YAMAHA FG830 NATURAL;
Акустическая гитара YAMAHA FG830 TOBACCO BROWN SUNBURST;
Акустическая гитара YAMAHA FG840 NATURAL;
Акустическая гитара YAMAHA FS100C BLK;
Акустическая гитара YAMAHA FS100C NT;
Акустическая гитара YAMAHA GL1;
Акустическая гитара YAMAHA GL1 BL;
Акустическая гитара YAMAHA JR1;
Акустическая гитара YAMAHA JR2 TBS;
Акустическая гитара YAMAHA LL6 ARE;
Акустическая гитара YAMAHA LS16;
"Акустическая система ""кабинет"" KUSTOM KG412 2.0";
Акустическая система (кабинет) YAMAHA THRC112;
Акустическая система (кабинет) для бас-гитары MarkBass MARCUS MILLER 102 CAB;
Акустическая система (кабинет) для бас-гитары MarkBass MARCUS MILLER 104 CAB;
Акустическая система (кабинет) для бас-гитары MarkBass NEW YORK 121;
Акустическая система (кабинет) для бас-гитары Markbass NEW YORK 122-;
Акустическая система (кабинет) для бас-гитары MarkBass NEW YORK 122 NINJA;
Акустическая система (кабинет) для бас-гитары MarkBass NEW YORK 151;
Акустическая система (кабинет) для бас-гитары MarkBass NEW YORK 151 BLACK;
Акустическая система (кабинет) для бас-гитары MarkBass NEW YORK 151 RJ;
Акустическая система (кабинет) для бас-гитары MarkBass STANDARD 104 HF;
Акустическая система (кабинет) для бас-гитары MarkBass STANDARD 104 HR;
Акустическая система (кабинет) для бас-гитары MarkBass STANDARD 151 HR;
Акустическая система (кабинет) для бас-гитары MarkBass TRAVELER 102 P;
Акустическая система (кабинет) для бас-гитары MarkBass TRAVELER 121 H;
Акустическая система (кабинет) для бас-гитары MarkBass TRAVELER 121 NINJA;
Акустическая система (кабинет) для бас-гитары MarkBass TRAVELER 123;
Акустическая система (кабинет) для бас-гитары MarkBass TRAVELER 151 P;
Акустическая система (кабинет) для электрогитары MarkBass DV 112 PLUS;
Акустическая система (кабинет) для электрогитары MarkBass DV JAZZ 208;
Акустическая система (кабинет) для электрогитары MarkBass DV NEOCLASSIC 112 Small;
Акустическая система (кабинет) для электрогитары MarkBass DV NEOCLASSIC 212;
Акустическая система (кабинет) для электрогитары MarkBass FG 212 V;
Акустическая система (пара) YAMAHA VXC4W;
Акустическая система (пара) YAMAHA VXC6W;
Акустическая система (пара) YAMAHA VXC8W;
Акустическая система (пара) YAMAHA VXS3FW;
Акустическая система (пара) YAMAHA VXS5W;
Акустическая система (пара) YAMAHA VXS8W;
Акустическая система AMC COM 20HP;
Акустическая система AMC COM 30HP;
Акустическая система AMC COM 320;
Акустическая система AMC COM 340;
Акустическая система AMC COM 40;
Акустическая система AMC COM 420;
Акустическая система AMC COM 440;
Акустическая система AMC iPlay 4WT;
Акустическая система AMC iPlay 5BT;
Акустическая система AMC iPlay 5WT;
Акустическая система AMC MC 4TA;
Акустическая система AMC MC 5T;
Акустическая система AMC MCS 20/TC;
Акустическая система AMC MH 50;
Акустическая система AMC MSH 30/T;
Акустическая система AMC PC 5T;
Акустическая система AMC PC 5TX;
Акустическая система AMC PC 8TX;
Акустическая система AMC PCR 5T;
Акустическая система AMC PCR 8T;
Акустическая система AMC SL 20MW;
Акустическая система AMC SP-10-;
Акустическая система AMC SPM 10HP;
Акустическая система AMC SUB 2;
Акустическая система AMC SUB100V;
Акустическая система AMC VIVA 3-302BT;
Акустическая система AMC VIVA 3-302ST-;
Акустическая система AMC VIVA 3-302WT;
Акустическая система AMC VIVA 3-502BT;
Акустическая система AMC VIVA 3-502WT;
Акустическая система AMC VIVA 4 RAL9016;
Акустическая система AMC VIVA 4IP RAL9017;
Акустическая система AMC VIVA 5 RAL9016;
Акустическая система AMC VIVA 5 RAL9017;
Акустическая система AMC VIVA 8 (RAL 9016);
Акустическая система AMC W 10RS;
Акустическая система BOSE F1 Model 812 active Flexible Array Loudspeaker;
Акустическая система BOSE L1 1S model with B2 bass;
Акустическая система Genelec 1032CPM;
Акустическая система Genelec 1237APM;
Акустическая система Genelec 7040APM;
Акустическая система Genelec 7050BPM;
Акустическая система Genelec 7350APM;
Акустическая система Genelec 7360APM;
Акустическая система Genelec 7370AP;
Акустическая система Genelec 7380AP;
Акустическая система Genelec 8010AP;
Акустическая система Genelec 8010AW;
Акустическая система Genelec 8020DPM;
Акустическая система Genelec 8020DWM;
Акустическая система Genelec 8030CP;
Акустическая система Genelec 8030CW;
Акустическая система Genelec 8040BPM;
Акустическая система Genelec 8040BWM;
Акустическая система Genelec 8050BPM;
Акустическая система Genelec 8050BWM;
Акустическая система Genelec 8260APM;
Акустическая система Genelec 8260AWM;
Акустическая система Genelec 8320APM;
Акустическая система Genelec 8320AWM;
Акустическая система Genelec 8330AP;
Акустическая система Genelec 8330AWM;
Акустическая система Genelec 8331AM;
Акустическая система Genelec 8331AP;
Акустическая система Genelec 8331AW;
Акустическая система Genelec 8340APM;
Акустическая система Genelec 8340AWM;
Акустическая система Genelec 8341AM;
Акустическая система Genelec 8341AP;
Акустическая система Genelec 8341AW;
Акустическая система Genelec 8350APM;
Акустическая система Genelec 8350AWM;
Акустическая система Genelec 8351AM;
Акустическая система Genelec 8351AP;
Акустическая система Genelec 8351AW;
Акустическая система Genelec 8430APM;
Акустическая система JBL CHARGE3SQUADEU;
Акустическая система JBL CHARGE4GRN;
Акустическая система JBL CHARGE4RED;
Акустическая система JBL FLIP5BLK;
Акустическая система JBL FLIP5GRY;
Акустическая система JBL GO2BLK;
Акустическая система JBL GO2BLU;
Акустическая система JBL JRPOPBLU;
Акустическая система JBL JRPOPGRN;
Акустическая система JBL JRPOPRED;
Акустическая система JBL PARTYBOX300EU;
Акустическая система JBL XTREME2BLKEU;
Акустическая система JDM CO-120;
Акустическая система JDM FA-210CE;
Акустическая система JDM FA-630NT;
Акустическая система KUSTOM HIPAC10;
Акустическая система KUSTOM HIPAC12;
Акустическая система Kustom KPX10A;
Акустическая система Kustom KPX12A;
Акустическая система KUSTOM KPX15A;
Акустическая система KUSTOM PA112-SC;
Акустическая система M-Audio DSM3-;
Акустическая система M-Audio Studiophile CX5-;
Акустическая система Park Audio VA401i;
Акустическая система Peecker Sound PSUTS;
Акустическая система Peecker Sound XTCS;
Акустическая система Stagg SMS12P;
Акустическая система Stagg SMS15DP760LCD_Н;
Акустическая система X-TREME XTC;
Акустическая система X-TREME XTD1015/A;
Акустическая система X-TREME XTM550;
Акустическая система X-TREME XTO;
Акустическая система YAMAHA A15;
Акустическая система YAMAHA A15W;
Акустическая система YAMAHA CBR10;
Акустическая система YAMAHA CBR12;
Акустическая система YAMAHA CBR15;
Акустическая система YAMAHA DBR10;
Акустическая система YAMAHA DBR15;
Акустическая система YAMAHA DSR115;
Акустическая система YAMAHA DSR118W;
Акустическая система YAMAHA DXR10;
Акустическая система YAMAHA DXR10MKII;
Акустическая система YAMAHA DXR12;
Акустическая система YAMAHA DXR12MKII;
Акустическая система YAMAHA DXR15;
Акустическая система YAMAHA DXR15MKII;
Акустическая система YAMAHA DXR8MKII;
Акустическая система YAMAHA DXS15;
Акустическая система YAMAHA DXS15MKII;
Акустическая система YAMAHA DXS15XLF;
Акустическая система YAMAHA DXS18;
Акустическая система YAMAHA DXS18XLF;
Акустическая система YAMAHA DZR10;
Акустическая система YAMAHA DZR12;
Акустическая система YAMAHA DZR15;
Акустическая система YAMAHA DZR315;
Акустическая система YAMAHA HS5;
Акустическая система YAMAHA HS5I;
Акустическая система YAMAHA HS5IW;
Акустическая система YAMAHA HS7;
Акустическая система YAMAHA HS7I;
Акустическая система YAMAHA HS7IW;
Акустическая система YAMAHA HS7W;
Акустическая система YAMAHA HS8;
Акустическая система YAMAHA HS8I;
Акустическая система YAMAHA HS8IW;
Акустическая система YAMAHA HS8S;
Акустическая система YAMAHA HS8W;
Акустическая система YAMAHA KS-SW100;
Акустическая система YAMAHA MSP3;
Акустическая система YAMAHA MSP5 STUDIO;
Акустическая система YAMAHA MSP7 STUDIO;
Акустическая система YAMAHA R112;
Акустическая система YAMAHA R115;
Акустическая система YAMAHA R118W;
Акустическая система YAMAHA S115V;
Акустическая система YAMAHA S-15-;
Акустическая система YAMAHA STAGEPAS 1K;
Акустическая система YAMAHA THRC212;
Акустическая система YAMAHA VS4;
Акустическая система YAMAHA VS4W;
Акустическая система YAMAHA VS6;
Акустическая система YAMAHA VS6W;
Акустическая система YAMAHA VXC3FW;
Акустическая система YAMAHA VXC5FW;
Акустическая система YAMAHA VXC8;
Акустическая система YAMAHA VXL1B-16;
Акустическая система YAMAHA VXL1W-8;
Акустическая система YAMAHA VXS10SW;
Акустическая система YAMAHA VXS1MLW;
Акустическая система YAMAHA VXS3SW;
Акустическая система активная JBL EON ONE/230;
Акустическая система активная JBL J104SET-EU;
Акустическая система активная Maximum Acoustics DIGITAL PRO.12 BLU;
Акустическая система активная Maximum Acoustics E.12 BLU;
Акустическая система активная Maximum Acoustics Pro.15 BLU;
Амбушюры JTS Ear cushion HP-535;
Антенна Audio-Technica ATCS-A60RX;
Антенна Audio-Technica ATCS-A60TX;
Антенны Audio-Technica ATW-A49;
Антенные бустеры Audio-Technica ATW-B80C;
Антенные бустеры Audio-Technica ATW-B80D;
Антенный кабель JTS RTF-3;
Антенный кабель JTS RTF-UF-20;
Ароматизатор жидкости для дым-машин American Audio Fog scent lemon;
Ароматизатор жидкости для дым-машин American Audio Fog scent mint;
Ароматизатор жидкости для дым-машин American Audio Fog scent vanilla;
Аудио интерфейс M-Audio Torq Xponent;
Аудио интерфейс Steinberg AXR4T;
Аудио интерфейс Steinberg UR12;
Аудио интерфейс Steinberg UR22 MKII;
Аудио интерфейс Steinberg UR22C;
Аудио интерфейс Steinberg UR242;
Аудио интерфейс Steinberg UR28M;
Аудио интерфейс Steinberg UR44;
Аудио интерфейс Steinberg UR44C;
Аудио интерфейс Steinberg UR816C;
Аудио интерфейс Steinberg UR824;
Аудио интерфейс Steinberg UR-RT2;
Аудио интерфейс Steinberg UR-RT4;
Аудио кабель Stagg NAC3PSXFR;
Банкетка On-Stage Stands KB8802B;
Банкетка On-Stage Stands KB8802R;
Банкетка On-Stage Stands KB8802W;
Банкетка On-Stage Stands KB8902B;
Банкетка Petrof M-105-0801;
Банкетка Stagg PB04 BKM VBK;
Банкетка Stagg PB04 BKP VBK;
Банкетка Stagg PB39 BK M;
Банкетка Stagg PB39 BKM SBK;
Банкетка Stagg PB39 IV P;
Банкетка Stagg PB39 IVP SBE;
Банкетка Stagg PB39 MH P;
Банкетка Stagg PB39 MHDM VBK;
Банкетка Stagg PB39 NATM VBK;
Банкетка Stagg PB39 OAK M;
Банкетка Stagg PB39 PEARLP VWH;
Банкетка Stagg PB39 RWM VBK;
Банкетка Stagg PB39 WH P;
Банкетка Stagg PB43 WN M S/BR;
Банкетка Stagg PB45 RWM;
Банкетка Stagg PBH 780 BKP VBK;
Банкетка Stagg PBH 780 WHP SWH;
Банкетка YAMAHA BC-100BK;
Банкетка YAMAHA BC-100DR-;
Банкетка YAMAHA BC-100DROP;
Банкетка YAMAHA BC-108 PE;
Банкетка YAMAHA BC-108BK;
Банкетка YAMAHA BC-108DR;
Банкетка YAMAHA BC-108DW;
Банкетка YAMAHA BC-108MH;
Банкетка YAMAHA BC-108WH;
Банкетка YAMAHA снят с производства BC-100MH;
Банкетка для рояля Stagg PB05 BKP SBK;
Банкетка для рояля Stagg PB05 BKP SVBK;
Банкетка для рояля Stagg PB05 BKP VBK;
Банкетка для рояля Stagg PB05 RWM VBK;
Банкетка для рояля Stagg PB05 WHM SWH;
Банкетка для рояля Stagg PB05 WHM VBE;
Банкетка для рояля Stagg PB39 BK P;
Банкетка для рояля Stagg PB39 BKM SVBK;
Банкетка для рояля Stagg PB39 BKP SVBK;
Банкетка для рояля Stagg PB39 BKP VBK;
Банкетка для рояля Stagg PB39 CHM VBK;
Банкетка для рояля Stagg PB39 IVP VBE;
Банкетка для рояля Stagg PB39 IVP VWH;
Банкетка для рояля Stagg PB39 MHP VBK;
Банкетка для рояля Stagg PB39 MHP VBR;
Банкетка для рояля Stagg PB39 RWM SBK;
Банкетка для рояля Stagg PB39 RWM SVBK;
Банкетка для рояля Stagg PB39 WH M;
Банкетка для рояля Stagg PB39 WHM SWH;
Банкетка для рояля Stagg PB39 WHM VBE;
Банкетка для рояля Stagg PB39 WHM VWH;
Банкетка для рояля Stagg PB39 WHP SBK;
Банкетка для рояля Stagg PB39 WHP VBK;
Банкетка для рояля Stagg PB39 WHP VWH;
Банкетка для рояля Stagg PB43 BKP S/BK;
Банкетка для рояля Stagg PB43 WNP SBR;
Барабан YAMAHA CSS1465A;
Барабанные палочки (пара) Kuppmen CFDS5A;
Барабанные палочки (пара) Kuppmen CFDS5B;
Барабанные палочки (пара) Kuppmen CFDS7A;
Барабанные палочки (пара) Kuppmen RCDS5A;
Барабанные палочки (пара) Kuppmen RCDS5B;
Барабанные палочки (пара) Kuppmen RCDS7A;
Барабанные палочки Stagg SH5A;
Барабанные палочки Stagg SH5AN;
Барабанные палочки Stagg SM5A;
Барабанные палочки Stagg SM5AN;
Барабанные палочки Stagg SM5B;
Барабанные палочки Stagg SM5BN;
Барабанные палочки Stagg SM7A;
Барабанные палочки Stagg SM7AN;
Барабанные палочки Stagg SMJZ;
Барабанные палочки Stagg SMS1;
Барабанные палочки Stagg SO5AN;
Барабанные палочки Stagg SO5B;
Барабанные палочки Stagg SO5BN;
Барабанные палочки Stagg SO7AN;
Барабанные палочки Stagg SOJZ;
Барабанный модуль YAMAHA EAD10;
Бас гитара MAXWOOD MEJB-2746;
Бас-барабан YAMAHA SBB2217 RB;
Бас-гитара G&L JB2 PREMIUM;
Бас-гитара Music Man Big Al 5 SSS;
Бас-гитара Music Man Caprice 124 S2 10 06 CS CR;
Бас-гитара Music Man StingRay 110 90 10 01 CS CR;
Бас-гитара Music Man StingRay 40th 117 OS 22 02 CS CR;
Бас-гитара Stagg B300 NS;
Бас-гитара Stagg B300 SB;
Бас-гитара Stagg BC300 BK;
Бас-гитара Stagg BC300 NS;
Бас-гитара Stagg BC300 SB;
Бас-гитара Stagg MB300 BK;
Бас-гитара YAMAHA BB234 VW;
Бас-гитара YAMAHA BB234 YLNS;
Бас-гитара YAMAHA BB614 BM;
Бас-гитара YAMAHA RBX375 DOG;
Бас-гитара YAMAHA RBX375 RM;
Бас-гитара YAMAHA TRBX174 BL;
Бас-гитара YAMAHA TRBX174 DBM;
Бас-гитара YAMAHA TRBX174 OVS;
Бас-гитара YAMAHA TRBX174 RM;
Бас-гитара YAMAHA TRBX204 BRIGHT RED METALLIC;
Бас-гитара YAMAHA TRBX204 GALAXY BLACK;
Бас-гитара YAMAHA TRBX204 GRAY METALLIC;
Бас-гитара YAMAHA TRBX204 OLD VIOLIN SUNBURST;
Бас-гитара YAMAHA TRBX304 BL;
Бас-гитара YAMAHA TRBX305 WH;
Басовая голова ASHDOWN ABM-500 EVO3;
Басовый кабинет Laney NX115;
Блок педалей YAMAHA LP-1B;
Блок педалей YAMAHA LP-1WH;
Блок педалей YAMAHA LP-5A;
Блок педалей YAMAHA LP-5A WH;
Блок педалей YAMAHA LP-7A;
