title;brand;model
Кабель микрофонный Stagg SMC6;
Кабель микрофонный Stagg SMC6 BL;
Кабель микрофонный Stagg SMC6 GR;
Кабель микрофонный Stagg SMC6 RD;
Кабель микрофонный Stagg SMC6 YW;
Кабель микрофонный Stagg SMC6XP;
Кабель микрофонный Stagg XMC10XX;
Кабель микрофонный, 100м Stagg ROLL M60/2 BH;
Кабель микрофонный, 100м Stagg ROLL M60/2 BK;
Кабель микрофонный, 100м Stagg ROLL M60/2 BKH;
Кабель микрофонный, 100м Stagg ROLL M60/2 GH;
Кабель мультикорный KLOTZ PW10164;
Кабель несимметричный аудио KLOTZ AC104RT;
Кабель несимметричный аудио KLOTZ AC104SW;
Кабель несимметричный аудио KLOTZ AC110SW;
Кабель несимметричный аудио KLOTZ IY205;
Кабель оптический KLOTZ FO02TT;
Кабель оптический KLOTZ FO03TT;
Кабель оптический KLOTZ FO05TT;
Кабель оптический KLOTZ FOPTM03;
Кабель оптический KLOTZ FOPTT01;
Кабель оптический KLOTZ FOPTT02;
Кабель оптический KLOTZ FOPTT03;
Кабель с соединителем YAMAHA MMF-SWP1;
Кабель с соединителями, 1м Stagg SYC1/MPSB2P E;
Кабель с соединителями, 2м Stagg SYC2/MPSB2P E;
Кабель симметричный аудио KLOTZ MY206GR;
Кабельный барабан KLOTZ GT310.RM;
Кабинет для электрогитары KUSTOM DEFENDER1x12;
Казу Stagg KAZOO-30;
Камертон Stagg GP-1;
Камертон Stagg TF1440;
Канифоль Stagg ROS VN3;
Каподастр Stagg SCPM-C;
Каподастр Stagg SCPM-F;
Каподастр Stagg SCPX-CU BG;
Каподастр Stagg SCPX-CU BK;
Каподастр Stagg SCPX-CU CR;
Каподастр Stagg SCPX-CU GD;
Каподастр Stagg SCPX-FL BG;
Каподастр Stagg SCPX-FL BK;
Каподастр Stagg SCPX-FL CR;
Каподастр Tanglewood TSPC;
Капсюль Groove Tubes C1;
Капсюль Groove Tubes C2;
Капсюль Groove Tubes C3;
Кардиоїдний вокальний мікрофон SHURE PGA48-XLR-E;
Кардиоїдний вокальний мікрофон SHURE PGA58-XLR-E;
Кастаньеты (пара) Stagg CAS-W;
Кастаньеты Stagg CAS-N;
Кастаньеты Stagg CAS-WT;
Каубелл Stagg CB309BK;
Каубелл Stagg TC-3;
Каубелл Stagg TC-5;
Каубелл Stagg TC-6;
Каубелл слэппер Stagg PRCB-S-SP;
Кахон BAJO JULIO 170123;
Кахон PALM PERCUSSION CJ BSP-FS R RED MAHONY;
Кейс JTS Drum case;
Кейс для акустической гитары Дреднаут Tanglewood 1SKB T45;
Кейс для микшерного пульта YAMAHA TF1 FLIGHT CASE;
Кейтар YAMAHA SHS-300BU;
Кейтар YAMAHA SHS-300WH;
Кейтар YAMAHA SHS-500B;
Кейтар YAMAHA SHS-500RD;
Клаве Stagg CL320S;
Клавинова YAMAHA CLP-430 M-;
Клавинова YAMAHA CLP-525R;
Клавинова YAMAHA CLP-535R;
Клавинова YAMAHA CLP-545R;
Клавинова YAMAHA CLP-565GP WH;
Клавинова YAMAHA CLP-625B;
Клавинова YAMAHA CLP-625PE;
Клавинова YAMAHA CLP-625R;
Клавинова YAMAHA CLP-625WH;
Клавинова YAMAHA CLP-635B;
Клавинова YAMAHA CLP-635DW;
Клавинова YAMAHA CLP-635PE;
Клавинова YAMAHA CLP-635R;
Клавинова YAMAHA CLP-635WA;
Клавинова YAMAHA CLP-635WH;
Клавинова YAMAHA CLP-645B;
Клавинова YAMAHA CLP-645DW;
Клавинова YAMAHA CLP-645PE;
Клавинова YAMAHA CLP-645R;
Клавинова YAMAHA CLP-645R без BT;
Клавинова YAMAHA CLP-645WA;
Клавинова YAMAHA CLP-645WH;
Клавинова YAMAHA CLP-645WH без BT;
Клавинова YAMAHA CLP-665GP;
Клавинова YAMAHA CLP-665GPWH;
Клавинова YAMAHA CLP-675B;
Клавинова YAMAHA CLP-675PE;
Клавинова YAMAHA CLP-675R;
Клавинова YAMAHA CLP-675R без BT;
Клавинова YAMAHA CLP-675WH;
Клавинова YAMAHA CLP-685B;
Клавинова YAMAHA CLP-685PE;
Клавинова YAMAHA CLP-685PWH;
Клавинова YAMAHA CSP-150B;
Клавинова YAMAHA CSP-150WH;
Клавинова YAMAHA CSP-170B;
Клавинова YAMAHA CSP-170WH;
Клавинова YAMAHA CVP-701 B;
Клавинова YAMAHA CVP-701 B + банкетка On-Stage Stands KB8902B;
Клавинова YAMAHA CVP-705B;
Клавинова YAMAHA CVP-709 PWH;
Клавинова YAMAHA CVP-709B;
Клавинова YAMAHA CVP-709GP WH;
Клавинова YAMAHA CVP-805B;
Клавинова YAMAHA CVP-809B;
Клавинова YAMAHA YDP-103B;
Клавинова YAMAHA YDP-103R;
Клавинова YAMAHA YDP-143R;
Клавинова YAMAHA YDP-143WH;
Клавинова YAMAHA YDP-144R;
Клавинова YAMAHA YDP-144WH;
Клавинова YAMAHA YDP-163R;
Клавинова YAMAHA YDP-163WH;
Клавинова YAMAHA YDP-164R;
Клавинова YAMAHA YDP-164WA;
Клавинова YAMAHA YDP-164WH;
Клавинова YAMAHA YDP-S54B;
Клавинова YAMAHA YDP-S54WH;
Кларнет Stagg 77-C;
Кларнет Stagg LV-CL4100;
Кларнет Stagg WS-CL110;
Кларнет YAMAHA YCL-250;
Кларнет, франц.система YAMAHA YCL-255;
Кларнет, французская система YAMAHA YCL-450;
Классическая гитара 1/2 Stagg C410 M NAT;
Классическая гитара 1/2 Stagg C510 DRAGONFLY;
Классическая гитара 1/2 Stagg C510 WH;
Классическая гитара 1/2 Stagg C516;
Классическая гитара 3/4 Stagg C430 M NAT;
Классическая гитара 3/4 Stagg C530;
Классическая гитара 3/4 Stagg C530 WH;
Классическая гитара CANTO ACG300 4/4;
Классическая гитара MAXWOOD MC-6503;
Классическая гитара SpongeBob SBJGOFT;
Классическая гитара Stagg C440 M BLK;
Классическая гитара Stagg C440 M BLUE;
Классическая гитара Stagg C440 M RED;
Классическая гитара Stagg C542;
Классическая гитара Stagg C542 BK;
Классическая гитара Stagg C542 TB;
Классическая гитара Stagg C542 TR;
Классическая гитара Stagg C542 WH;
Классическая гитара Tanglewood DBT44;
Классическая гитара Tanglewood DBT44BK;
Классическая гитара YAMAHA C-40;
Классическая гитара YAMAHA C40BL;
Классическая гитара YAMAHA C-40M;
Классическая гитара YAMAHA C-70;
Классическая гитара YAMAHA CG102;
Классическая гитара YAMAHA CG122MC;
Классическая гитара YAMAHA CG122MS;
Классическая гитара YAMAHA CG142C;
Классическая гитара YAMAHA CG142S;
Классическая гитара YAMAHA CG162C;
Классическая гитара YAMAHA CG162S;
Классическая гитара YAMAHA CG182S;
Классическая гитара YAMAHA CM40;
Классическая гитара YAMAHA CS-40;
Классическая гитара с датчиком Stagg C546TCE BK;
Классическая гитара с датчиком Stagg C546TCE BLS;
Классическая гитара с датчиком Stagg C546TCE N;
Классическая гитара с датчиком YAMAHA CX40;
Ключ для настройки барабанов Stagg K-60;
Ключ для настройки барабанов Stagg K-66;
Колки DR PARTS AMH7001/CR;
Колки DR PARTS AMH7001/GD;
Колки DR PARTS CMH0350/GD;
Колки VALENCIA VCMH0150/GD;
Колокольчики Stagg BEL;
Колокольчики Stagg MOB-9;
Колокольчики Stagg PCH120-WF;
Колокольчики Stagg SLB-25;
Колокольчики Stagg SLBM-13T;
Колокольчики Stagg SLBS-21;
Комбо усилитель DV Mark AC 801 P;
Комбо усилитель DV Mark DV 40 212;
Комбо усилитель DV Mark DV LITTLE JAZZ BLACK Edition;
Комбо усилитель MarkBass AC 101 H;
Комбо усилитель MarkBass DV 40 112;
Комбо усилитель MarkBass DV JAZZ 212;
Комбо усилитель MarkBass DVJAZZ 12;
Комбо усилитель акустический ASHDOWN Cube 40BK;
Комбо усилитель акустический Laney LA20C;
Комбо усилитель для акустичесикх инструментов KUSTOM SIENNA16PRO;
Комбо усилитель для акустических инструментов KUSTOM SIENNA30PRO;
Комбо усилитель для акустических инструментов KUSTOM SIENNA35PRO;
Комбо усилитель для акустических инструментов KUSTOM SIENNA65PRO;
Комбо усилитель для бас-гитары KUSTOM KXB10;
Комбо усилитель для бас-гитары KUSTOM KXB100;
Комбо усилитель для бас-гитары KUSTOM KXB20;
Комбо усилитель для бас-гитары MarkBass CMD 102 P;
Комбо усилитель для бас-гитары MarkBass CMD SUPER COMBO K1;
Комбо усилитель для бас-гитары MarkBass MINIMARK 802;
Комбо усилитель ламповый Laney CUB8;
Комбо усилитель ламповый Laney L20T-410;
Комбо усилитель ламповый LANEY LV100;
Комбо усилитель с ревербератором Laney LX65RCAMO;
Комбо усилитель с цифр. эффектами Laney LR20;
Комбо усилитель с цифр. эффектами Laney P35;
Комбо-усилитель ASHDOWN AAR-1VR;
Комбо-усилитель ASHDOWN AA-TBUS15;
Комбо-усилитель HAYDEN H-FA-50-A;
Комбоусилитель Kustom KG1 2.0;
Комбо-усилитель KUSTOM KG100FX112 2.0;
Комбо-усилитель KUSTOM KG100FX212 2.0;
Комбо-усилитель KUSTOM KG112FX 2.0;
Комбо-усилитель KUSTOM KG212FX 2.0;
Комбоусилитель Kustom KGBAT10;
Комбоусилитель для бас-гитары KUSTOM DE50;
Комбоусилитель для бас-гитары KUSTOM KXB1;
Комбоусилитель для бас-гитары MarkBass CMD 121 H;
Комбоусилитель для бас-гитары MarkBass CMD 151 P;
Комбоусилитель для бас-гитары MarkBass CMD JB PLAYERS SCHOOL;
Комбоусилитель для бас-гитары MarkBass COMBO 121 LITE;
Комбоусилитель для бас-гитары MarkBass MICROMARK 801;
Комбоусилитель для бас-гитары MarkBass MINI CMD 121 P;
Комбоусилитель для бас-гитары MarkBass MINI CMD 151 P;
Комбоусилитель для клавишных инструментов KUSTOM KMA 35DFX;
Комбоусилитель для электрогитары DV Mark DV AC 101;
Комбоусилитель для электрогитары DV Mark DV LITTLE JAZZ;
Комбоусилитель для электрогитары DV Mark DVC GEN 15;
Комбоусилитель для электрогитары DV Mark DVC GUITAR FRIEND 12;
Комбоусилитель для электрогитары KUSTOM DEFENDER V15;
Комбоусилитель для электрогитары KUSTOM DEFENDER V5;
Комбоусилитель для электрогитары KUSTOM HV100T;
Комбоусилитель для электрогитары KUSTOM HV20T;
Комбоусилитель для электрогитары KUSTOM HV30T;
Комбоусилитель для электрогитары KUSTOM HV65T;
Комбоусилитель для электрогитары KUSTOM KG1;
Комбоусилитель для электрогитары KUSTOM KG100FX112;
Комбоусилитель для электрогитары KUSTOM KG112FX;
Комбоусилитель для электрогитары KUSTOM KG210FX;
Комбоусилитель для электрогитары KUSTOM KG212FX;
Комбоусилитель для электрогитары YAMAHA GA15II;
Комбоусилитель для электрогитары YAMAHA THR10;
Комбоусилитель для электрогитары YAMAHA THR10C;
Комбоусилитель для электрогитары YAMAHA THR10II;
Комбоусилитель для электрогитары YAMAHA THR10X;
Комбоусилитель для электрогитары YAMAHA THR30II WIRELESS;
Комбоусилитель для электрогитары YAMAHA THR5;
Комбоусилитель для электрогитары YAMAHA THR5A;
Комбоусилитель для электронных барабанов Kustom KDA200;
Коммутационный кабель KLOTZ GRG1PP03.0;
Коммутационный кабель KLOTZ GRG1PP06.0;
Коммутационный кабель KLOTZ KT-CC090;
Комплект барабанов ударной установки YAMAHA RDP0F5 BGG;
Комплект барабанов ударной установки YAMAHA RDP0F5 BLG;
Комплект барабанов ударной установки YAMAHA RDP0F5 FINEBLUE;
Комплект барабанов ударной установки YAMAHA RDP0F5 HOTRED;
Комплект барабанов ударной установки YAMAHA RDP0F5 MEYELLOW;
Комплект барабанов ударной установки YAMAHA RDP0F5 SLG;
Комплект барабанов ударной установки YAMAHA RDP2F5 BGG;
Комплект барабанов ударной установки YAMAHA RDP2F5 BLG;
Комплект барабанов ударной установки YAMAHA RDP2F5 FINEBLUE;
Комплект барабанов ударной установки YAMAHA RDP2F5 HOTRED;
Комплект барабанов ударной установки YAMAHA RDP2F5 MEYELLOW;
Комплект барабанов ударной установки YAMAHA RDP2F5 SLG;
Комплект для звукозаписи Steinberg UR22 Production studio;
Комплект для ухода за кларнетом Stagg SCK-CL;
Комплект для ухода за саксофоном Stagg SCK-SX;
Комплект для ухода за трубой Stagg SCK-TP;
Комплект для ухода за флейтой Stagg SCK-FL;
Комплект медиаторов Stagg FPS-L;
Комплект микрофонов Audio-Technica MB/DK5;
Комплект микрофонов Audio-Technica MB/DK7;
Комплект подставок для ак.систем On-Stage Stands SSP7950;
Комплект подставок для акустических систем On-Stage Stands SSP7850;
Комплект подставок для ударної установки YAMAHA HW780;
Комплект пэтчкордов Stagg SPC008L E;
Комплект светоприборов American Audio Festive LED Pak;
Конго Stagg CWM A-DA;
Конго Stagg CWM N-D;
Конго Stagg CWM N-DA;
Конго Stagg CWML-N-DA;
Конго Stagg PCW-9;
Контроллер Steinberg CC121;
Контроллер YAMAHA DCP4S-EU;
Контроллер YAMAHA DCP4V4S-EU;
Контроллер стробоскопа American Audio S-10S;
Контрольная поверхность YAMAHA CS-R10;
Корнет STAGG 77-TC-;
Корнет STAGG 77-TCR-;
Корнет Stagg WS-CR215S;
Корнет YAMAHA YCR-2330II;
Крепежная планка Stagg FIVE BAR;
Крепление для акустических систем Stagg SPH-15BK/2;
Кронштейн On-Stage Stands SS7920;
Кронштейн On-Stage Stands SSA1;
Кронштейн On-Stage Stands SSA15;
Кронштейн YAMAHA BWS20-190;
Кронштейн для АС Stagg SPH-15 BK;
Крюк Stagg DIS-GUH5;
Крюк Stagg DIS-MIH;
Крюк Stagg DIS-SAH BK;
Крюк Stagg DIS-SAH SL;
Крюк для подвеса гитары Stagg GUH-7;
Крюк для подвеса гитары Stagg GUH-8;
Крюк для подвешивания гитары On-Stage Stands GS7640;
Крюк для подвешивания гитары On-Stage Stands GS7730;
Ксилофон Stagg XYLO-SET 37;
Ксилофон YAMAHA YX135;
Лампа накаливания American Audio LL 12V/100W GZ6,35;
Лампа накаливания American Audio OS 230V/300W G6,35;
Лампа накаливания American Audio PH 12V/100W;
Лампа подсветки YAMAHA LA-1L;
Легкий футляр для бас-гитары Stagg HGB2-B;
Легкий футляр для электрогитары Stagg HGB2-RE;
Лира YAMAHA FLL;
Лира YAMAHA SLL-2;
Лира YAMAHA TRL-1;
Лира YAMAHA TRL-2;
Литавры YAMAHA TP3323;
Литавры YAMAHA TP3326;
Литавры YAMAHA TP3329;
Литавры YAMAHA TP3332;
Лотус флейта Stagg LOT-LO/PL;
Малый барабан YAMAHA AMS1460 SOB;
Маракасы Stagg EGG-MA L GR;
Маракасы Stagg EGG-MA L MG;
Маракасы Stagg EGG-MA L OR;
Маракасы Stagg EGG-MA L PP;
Маракасы Stagg EGG-MA L RD;
Маракасы Stagg EGG-MA L YW;
Маракасы Stagg EGG-MA S GR;
Маракасы Stagg EGG-MA S MG;
Маракасы Stagg EGG-MA S OR;
Маракасы Stagg EGG-MA S PP;
Маракасы Stagg EGG-MA S RD;
Маракасы Stagg EGG-MA S YW;
Маракасы Stagg MRP-12 PK;
Маракасы Stagg MRP-19 YW;
Маракасы Stagg MRP-20 YW;
Маракасы Stagg MRW-16;
Маракасы Stagg MRW-19;
Маракасы Stagg MRW-26;
Маракасы Stagg MRW-26M;
Маракасы Stagg MSN-3;
Маршевые колокола YAMAHA MBL32A;
Маршевый барабан Stagg SDS-1455MT;
Маршевый барабан Stagg SDS-1455ST8/M;
Маршевый бас-барабан Stagg MABD-2612;
Маршевый малый барабан Stagg MSD-1410;
Масло YAMAHA KEY OIL LIGHT;
Масло YAMAHA ROTOR OIL 38ML;
Масло YAMAHA ROTOR OIL 40ML;
Масло YAMAHA ROTOR SPINDLE OIL;
Масло YAMAHA ROTOR SPINDLE OIL 20 ML;
Масло YAMAHA VALVE OIL LIGHT 60ML;
Масло YAMAHA VALVE OIL REGULAR;
Масло YAMAHA VALVE OIL REGULAR 60ML;
Масло YAMAHA VALVE OIL VINTAGE 60ML;
Масло для клавишь YAMAHA KEY OIL HEAVY-;
Масло для клавишь YAMAHA KEY OIL LIGHT 20 ML;
Масло для клавишь YAMAHA KEY OIL MEDIUM-;
Масло для настроечной трубки YAMAHA TUNING SLIDE OIL 20 ML;
Масло для шарниров YAMAHA LEVER OIL-;
Мегафон HW-2501R;
Медиатор Ernie Ball P09126;
Металлофон Stagg META-K12 RB;
Металлофон Stagg META-K15 RB;
Металлофон Stagg META-K8;
Металлофон Stagg META-K8 RB;
Металлофон Stagg META-KC8;
Метроном YAMAHA ME-150BK;
Метроном YAMAHA ME-55BK;
Микрофон AKG C1000S;
Микрофон AKG C-411 PP;
Микрофон AKG C-417 L;
Микрофон AKG C44;
Микрофон AKG C5;
Микрофон AKG C-518 M;
Микрофон AKG C-519 M;
Микрофон AKG CHM-99 BLACK;
Микрофон AKG P220;
Микрофон AKG P3S;
Микрофон AKG P5S;
Микрофон American Audio DJM-58;
Микрофон Audio-Technica ATUC-M43H;
Микрофон Audio-Technica ATUC-M58H;
Микрофон Audio-Technica ATW-T1002;
Микрофон Audio-Technica ATW-T1006;
Микрофон Groove Tubes L.L.C. GT44;
Микрофон JTS ST-850;
Микрофон M-AUDIO Aries-;
Микрофон M-Audio Luna II;
Микрофон M-Audio Pulsar II-;
Микрофон M-Audio Solaris-;
Микрофон SENNHEISER E-608;
Микрофон SENNHEISER E-865S;
Микрофон SENNHEISER ME 3-EW;
Микрофон SHURE BETA57A;
Микрофон SHURE BETA58A;
Микрофон SHURE BETA87A;
Микрофон SHURE SM58LCE;
Микрофон SHURE SM58SE;
Микрофон Stagg MD-007 BKH;
Микрофон вокальный AKG P5i;
Микрофон вокальный Audio-Technica AE3300;
Микрофон вокальный Audio-Technica AE4100;
Микрофон вокальный Audio-Technica AE5400;
Микрофон вокальный Audio-Technica AE6100;
Микрофон вокальный Audio-Technica ATM510;
Микрофон вокальный Audio-Technica ATM610a;
Микрофон вокальный Audio-Technica ATM710;
Микрофон головной Audio-Technica ATM73a;
Микрофон головной Audio-Technica ATM75CB;
Микрофон головной Audio-Technica ATM75cW;
Микрофон головной Audio-Technica BP892cW;
Микрофон головной Audio-Technica BP894cW-TH;
Микрофон головной Audio-Technica PRO8HEcW;
Микрофон головной Audio-Technica PRO92cW-TH;
Микрофон граничного слоя JTS CM-601;
Микрофон граничного слоя JTS CM-602;
Микрофон граничного слоя JTS CM-602USB;
Микрофон динамический Audio-Technica BP40;
Микрофон динамический Audio-Technica BP4001;
Микрофон динамический Audio-Technica MB1k;
Микрофон динамический Audio-Technica MB2k;
Микрофон динамический Audio-Technica MB3k;
Микрофон динамический Audio-Technica PRO25ax;
Микрофон динамический Audio-Technica PRO31;
Микрофон динамический Audio-Technica PRO31QTR;
Микрофон динамический Audio-Technica PRO41;
Микрофон динамический Audio-Technica PRO61;
Микрофон динамический JTS CX-08S;
Микрофон динамический JTS JM-X6-;
Микрофон динамический JTS NX-2;
Микрофон динамический JTS NX-6;
Микрофон динамический JTS NX-7;
Микрофон динамический JTS NX-7S;
Микрофон динамический JTS NX-8;
Микрофон динамический JTS NX-8S;
Микрофон динамический JTS PDM-3;
Микрофон динамический JTS PDM-57;
Микрофон динамический JTS PT-900B+CM-501*804.750;
Микрофон динамический JTS SX-7;
Микрофон динамический JTS TM-929;
Микрофон динамический JTS TM-989;
Микрофон динамический JTS TX-2;
Микрофон динамический JTS TX-6;
Микрофон динамический JTS TX-8;
Микрофон динамический SENNHEISER E 825-S;
Микрофон динамический SENNHEISER E835-S;
Микрофон динамический SENNHEISER E-845S;
Микрофон динамический кардиоидный SENNHEISER E-945;
Микрофон для аккордеона JTS CX-516;
Микрофон для духовых JTS CX-508;
Микрофон для ударных JTS CX-505;
Микрофон для ударных JTS CX-506;
Микрофон инструментальный Audio-Technica ATM230;
Микрофон инструментальный Audio-Technica ATM250DE;
Микрофон инструментальный Audio-Technica ATM350;
Микрофон инструментальный Audio-Technica ATM350cW;
Микрофон инструментальный Audio-Technica ATM350D;
Микрофон инструментальный Audio-Technica ATM350PL;
Микрофон инструментальный Audio-Technica ATM350U;
Микрофон инструментальный Audio-Technica ATM450;
Микрофон инструментальный Audio-Technica ATM650;
Микрофон инструментальный Audio-Technica PRO35cW;
Микрофон кардиоидный SENNHEISER E-935;
Микрофон конденсаторный Audio-Technica AT8035;
Микрофон конденсаторный Audio-Technica AT875R;
Микрофон конденсаторный Audio-Technica ATCS-60MIC;
Микрофон конденсаторный Audio-Technica ATR4697;
Микрофон конденсаторный Audio-Technica ATR6250;
Микрофон конденсаторный Audio-Technica ATR6550;
Микрофон конденсаторный Audio-Technica BP4029;
Микрофон конденсаторный Audio-Technica ES915SC12;
Микрофон конденсаторный Audio-Technica ES933C;
Микрофон конденсаторный Audio-Technica ES945;
Микрофон конденсаторный Audio-Technica MB4k;
Микрофон конденсаторный Audio-Technica PRO24-CMF;
Микрофон конденсаторный Audio-Technica PRO35;
Микрофон конденсаторный Audio-Technica PRO37;
Микрофон конденсаторный Audio-Technica PRO49Q;
Микрофон конденсаторный Audio-Technica PRO49QL;
Микрофон конденсаторный Audio-Technica U857QL;
Микрофон конденсаторный Audio-Technica U873R;
Микрофон конденсаторный JTS CX-509;
Микрофон конденсаторный JTS GM-5206;
Микрофон конденсаторный JTS GM-5206L;
Микрофон конденсаторный JTS GM-5212;
Микрофон конденсаторный JTS GM-5212DU;
Микрофон конденсаторный JTS GM-5212L;
Микрофон конденсаторный JTS GM-5218;
Микрофон конденсаторный JTS GM-5218L;
Микрофон конденсаторный JTS GML-5206;
